,ID,Date,User,Tweet,Media,Hashtags
801,1347094819642998785,2021-01-07 08:16:47+00:00,Abdul248Abdul,Shot woman among 4 dead after Trump mob riots at US Capitol with 52 arrested https://t.co/Pdfv2NhXiA,,
802,1347094734804840449,2021-01-07 08:16:27+00:00,myprwirenews,"RT @thisisinsider: The US Capitol Building was vandalized during a riot by President Trump supporters resulting in one person being killed and others injured. 

Here’s what the US Capitol looked like after rioters failed to overturn the 2020 Election.
https://t.co/AQYaRmANLw",,
803,1347092634850918400,2021-01-07 08:08:06+00:00,SidyBarrey,US Capitol riots: Mike Pence - not Trump called in National Guard | Daily Mail Online https://t.co/cIHiPiB7ce,,
804,1347091854450450432,2021-01-07 08:05:00+00:00,KING5Seattle,"It's been more than 200 years since an attack at the US Capitol on the scale of Wednesday's riot by Trump supporters, https://t.co/0F5ilBmTNN",,
805,1347090699565453318,2021-01-07 08:00:25+00:00,everydayrobsten,"Weirdest Moment of the US Capitol Riot: A Walis Tambo Being Paraded by a Filipino Trump Supporter https://t.co/jbFcHuEkfK #Esquiremag.ph via @EsquirePH

WALIS TAMBO PA NGA AMPOTA!",,['Esquiremag']
806,1347090557521305600,2021-01-07 07:59:51+00:00,avecozave,"US Capitol lockdown LIVE: Shot woman among 4 dead after Trump mob riots with 52 arrested

https://t.co/WRZtOk75vq",,
807,1347090439933992961,2021-01-07 07:59:23+00:00,sweetnonnie,DC Police Chief: 4 people died at the US Capitol Trump riots https://t.co/RDaCOdV9xU,,
808,1347090205019435009,2021-01-07 07:58:27+00:00,sabremssoftware,Violence engulfs US Capitol as Trump supporters run riot - BBC News https://t.co/8c7Fa3uzot,,
809,1347089551009968128,2021-01-07 07:55:51+00:00,GodfreyDeAcre,Riot at US Capitol: Four dead as outrage grows over Trump-inspired mob's storming of Congress | US News | Sky News https://t.co/xv5Tyyqjow,,
810,1347089231101890561,2021-01-07 07:54:35+00:00,TheNationalBul1,"US Violence: Barack Obama Accused President Donald Trump Of Inciting Supporters To Riot

@BarackObama @realDonaldTrump

#Trump #USCapitol #usviolence #USViolence #CapitolHill #capitollockdown #CapitolRiots #CapitalBuilding #capitolbreach #Capitol #bhakts

https://t.co/dRYc5SgNbj",,"['Trump', 'USCapitol', 'usviolence', 'USViolence', 'CapitolHill', 'capitollockdown', 'CapitolRiots', 'CapitalBuilding', 'capitolbreach', 'Capitol', 'bhakts']"
811,1347088809641521153,2021-01-07 07:52:54+00:00,ReformedPsycho,"US Capitol riots: Four dead after Trump protesters storm Washington - latest news
https://t.co/z7luptwq29",,
812,1347087683122769927,2021-01-07 07:48:25+00:00,manunitedaily,Donald Trump has Twitter and Facebook accounts suspended following US Capitol riot https://t.co/o04ZNONSbg,,
813,1347087258990600192,2021-01-07 07:46:44+00:00,brajeshupadhyay,"US Capitol siege: Donald Trump supporters occupy Congress, vandalise Nancy Pelosi's office; at least four dead in riots https://t.co/lON0NwoOFr","[Photo(previewUrl='https://pbs.twimg.com/media/ErHQuVpXEAEeTHa?format=png&name=small', fullUrl='https://pbs.twimg.com/media/ErHQuVpXEAEeTHa?format=png&name=orig', altText=None)]",
814,1347087081718378496,2021-01-07 07:46:02+00:00,NavyVetResister,DC Police Chief: 4 people died at the US Capitol Trump riots https://t.co/MNfs1sMWd9,,
815,1347086568461279234,2021-01-07 07:44:00+00:00,RawStory,"DC Police Chief: 4 people died at the US Capitol Trump riots
https://t.co/QtN0beM3Zz",,
816,1347086526769995776,2021-01-07 07:43:50+00:00,annieaylene,Trump Inspired Riot at US Capitol During Election Certification. America... https://t.co/diyuseOpPb via @YouTube,,
817,1347086519195078657,2021-01-07 07:43:48+00:00,ziggysblues,"'A direct attack on democracy': World leaders react with shock, sadness after Trump supporters riot at US Capitol https://t.co/kNbS0Tv6fb via @usatoday",,
818,1347086359580835840,2021-01-07 07:43:10+00:00,Jumuahabiodun,"US Capitol Riot: Twitter Locks Trump’s Account, Delete His Tweets, Threatens To Suspend Him https://t.co/mfGMBplAzs",,
819,1347086355755655168,2021-01-07 07:43:09+00:00,WorldTopNewsNG,"US Capitol Riot: Twitter Locks Trump’s Account, Delete His Tweets, Threatens To Suspend Him https://t.co/HMsXGnuuJ6",,
820,1347086035008835584,2021-01-07 07:41:53+00:00,rhumour,"Daily Mail: US Capitol riots: Giuliani demanded 'trial by combat' hours earlier Daily Mail: US Capitol riots: Giuliani demanded 'trial by combat' hours earlier.
https://t.co/3i2d0AKrtV 
So Trump &amp; Giuliani incite combat and the mob oblige. 4 dead, many arrests - 25th ammendment!",,
821,1347085385663447040,2021-01-07 07:39:18+00:00,Laura_Mihaela,"US Capitol riots by Donald Trump supporters end with four deaths, including a woman shot by police https://t.co/sfDLgXrYA8",,
822,1347085332152537088,2021-01-07 07:39:05+00:00,fox43,Photos of US Capitol show stark difference from Trump inauguration to Wednesday's riot https://t.co/xsdOeVYqeM,,
823,1347085168473894919,2021-01-07 07:38:26+00:00,Dl0RJK,"seeing filipinos being apart of that damn riot who stormed US CAPITOL is disappointing really, imagine how blind they are to see the truthfulness?? trump has insulted us many times and doesn’t even care about you WAKE TF UP. https://t.co/gW21ZN9IfC","[Photo(previewUrl='https://pbs.twimg.com/media/ErHOzN6VQAAKQxB?format=jpg&name=small', fullUrl='https://pbs.twimg.com/media/ErHOzN6VQAAKQxB?format=jpg&name=orig', altText=None)]",
824,1347084738914361347,2021-01-07 07:36:44+00:00,hotzeknotz,"US culture 101: If you’re white, possibly armed and want to enter the Capitol by force, police let you. Opening the fence, let you do your thing and guide you out peacefully afterwards.

#CapitolBuilding #RIOTS #Washington #Trump",,"['CapitolBuilding', 'RIOTS', 'Washington', 'Trump']"
825,1347084555342196736,2021-01-07 07:36:00+00:00,TonyHiteNFL,"All the jackasses who stormed the #Capitol today, all the asses who walk and riot in #MAGA gear, all of #Trump’s flying monkeys who hang on that idiot’s every word, just know when you “protest” or complain the rest of us just see and hear this from you 👇🏻👇🏻#TrumpLostGetOverIt https://t.co/9p8AjXe2Vc","[Gif(thumbnailUrl='https://pbs.twimg.com/tweet_video_thumb/ErHOQtDXIAE7P4e.jpg', variants=[VideoVariant(url='https://video.twimg.com/tweet_video/ErHOQtDXIAE7P4e.mp4', contentType='video/mp4', bitrate=0)], altText='Sad Baby GIF')]","['Capitol', 'MAGA', 'Trump', 'TrumpLostGetOverIt']"
826,1347084417618096128,2021-01-07 07:35:27+00:00,DRMatcero,Riot at US Capitol: Four dead as outrage grows over Trump-inspired mob's storming of Congress https://t.co/jChWqTmK7M,,
827,1347084364165898241,2021-01-07 07:35:14+00:00,cardcounterswin,"Trump allies speaking out against US Capitol Building protests, riots - Business Insider - Business Insider https://t.co/1KjIiLG6IL",,
828,1347083941858193408,2021-01-07 07:33:34+00:00,AfricaTimesofN1,Four dead in US Capitol riot after Donald Trump’s supporters storm Washington https://t.co/s5R8iCtHqG,,
829,1347083941182726146,2021-01-07 07:33:33+00:00,AfricaTimesofN1,US Capitol riots: Four dead after Trump protesters storm Washington https://t.co/2LiXuDkH6x,,
830,1347083832122609664,2021-01-07 07:33:07+00:00,b9d86161cc89425,Trump Inspired Riot at US Capitol During Election Certification. America... https://t.co/nRRabT3OHx via @YouTube,,
831,1347083579042521089,2021-01-07 07:32:07+00:00,HJAcivillibs,"Lawmakers have returned to the US Capitol to finish certifying Joe Biden's election victory, hours after Trump supporters stormed the building in a riot that saw four people die https://t.co/ZFFKQVkRPz",,
832,1347083223105470464,2021-01-07 07:30:42+00:00,jt120651,"Facebook, Twitter and YouTube take action on Trump’s posts amid riots at the US Capitol https://t.co/MikwnSQbJn",,
833,1347082903860228097,2021-01-07 07:29:26+00:00,SocialistVoice,"Mary Trump says all lawmakers backing the outgoing US President amid the Capitol riots should be expelled

At least four people have lost their lives in riots, say police

 https://t.co/bngfxpPq6o",,
834,1347082799900094464,2021-01-07 07:29:01+00:00,DikshaYadav____,"Same people and media  who cheered murder of  hundreds of minority innocents by hindu nationalists during Delhi riots, attack on students during anti-CAA protests, called farmers khalistanis are now  condemning attack on US Capitol &amp; Trump!  

#USCapitolRiot #DelhiRiots",,"['USCapitolRiot', 'DelhiRiots']"
835,1347082721533812736,2021-01-07 07:28:43+00:00,glitteryloulou,Time for a straight jacket and the 25th amendment!!! So sorry for my friends in the USA 💔                                               Riot at US Capitol: Four dead as outrage grows over Trump-inspired mob's storming of Congress | US News | Sky News https://t.co/xTkAeSpyuw,,
836,1347082450971877379,2021-01-07 07:27:38+00:00,iPicNews,Riot at US Capitol: Four dead as outrage grows over Trump-inspired mob's storming of Congress | US News | Sky News https://t.co/3vCkphzHJC,,
837,1347081410541195264,2021-01-07 07:23:30+00:00,Agegenews,"Photo News:
Assault of the US Capitol by a mob intent on overturning the election results.

#usa #USAElections #trump
#riot #biden #capitol #news #worldnews https://t.co/oazJeyCunH","[Photo(previewUrl='https://pbs.twimg.com/media/ErHLYu4XMAQiy9W?format=jpg&name=small', fullUrl='https://pbs.twimg.com/media/ErHLYu4XMAQiy9W?format=jpg&name=orig', altText=None), Photo(previewUrl='https://pbs.twimg.com/media/ErHLY-kWMAA14rB?format=jpg&name=small', fullUrl='https://pbs.twimg.com/media/ErHLY-kWMAA14rB?format=jpg&name=orig', altText=None), Photo(previewUrl='https://pbs.twimg.com/media/ErHLZQVXAAInbzx?format=jpg&name=small', fullUrl='https://pbs.twimg.com/media/ErHLZQVXAAInbzx?format=jpg&name=orig', altText=None), Photo(previewUrl='https://pbs.twimg.com/media/ErHLZapW4AAV29w?format=jpg&name=small', fullUrl='https://pbs.twimg.com/media/ErHLZapW4AAV29w?format=jpg&name=orig', altText=None)]","['usa', 'USAElections', 'trump', 'riot', 'biden', 'capitol', 'news', 'worldnews']"
838,1347081277346893825,2021-01-07 07:22:58+00:00,charlieeasmon,Riot at US Capitol: Four dead as outrage grows over Trump-inspired mob's storming of Congress | US News | Sky News https://t.co/IFEglVkL6j,,
839,1347080412577689601,2021-01-07 07:19:32+00:00,citizencurran,"FFS Fran 
US riots at Capitol Hill: Kiwi Chris Liddell weighs up resigning as Donald Trump's deputy chief of staff, via @nzherald https://t.co/3mnlecOs73",,
840,1347080269447180289,2021-01-07 07:18:58+00:00,ThisTrainIsLost,"Van Jones: US Capitol riot is treason and rebellion. Period. https://t.co/bbSj1qYDQ4 
Is THIS going to finally wake up the lawful authorities? Or is this just a few more steps along Trump’s road to an authoritarian regime? Believe me, the Nazis would’ve ended this in a few hours.",,
841,1347080246345007105,2021-01-07 07:18:52+00:00,MartinG8177,US representatives plan to impeach Donald Trump for inciting Capitol riots https://t.co/tjnh6TA34W,,
842,1347079683456839681,2021-01-07 07:16:38+00:00,SDGMasterglass,Riot at US Capitol: Four dead as outrage grows over Trump-inspired mob's storming of Congress https://t.co/kn5yHmg3bT,,
843,1347079419744182278,2021-01-07 07:15:35+00:00,americanguy40,"US Capitol riots by Donald Trump supporters end with four deaths, including a woman shot by police https://t.co/zvITfaf1n5 
DONALD YA GOT THE BLOOD OF FOUR DEAD AMERICANS ON YOUR HANDS...🇺🇸",,
844,1347079156798951424,2021-01-07 07:14:33+00:00,Eastendersfanau,Trump Inspired Riot at US Capitol During Election Certification. America... https://t.co/2qFR9mLrm4 via @YouTube,,
845,1347078781467389954,2021-01-07 07:13:03+00:00,EngGujaratEx,"4 dead, several injured as Trump supporters storm US Capitol
#uscapitol #trumpsupporters #riots #DeathToll #USAToday #unitedstatesofamerica 
https://t.co/ayEliA2VNU",,"['uscapitol', 'trumpsupporters', 'riots', 'DeathToll', 'USAToday', 'unitedstatesofamerica']"
846,1347078522938994688,2021-01-07 07:12:02+00:00,AliBunkallSKY,Riot at US Capitol: Four dead as outrage grows over Trump-inspired mob's storming of Congress: https://t.co/vfuZEgmLS4,,
847,1347078035019857920,2021-01-07 07:10:05+00:00,WHAS11,Photos of US Capitol show stark difference from Trump inauguration to Wednesday's riot https://t.co/gahvdI4Oee,,
848,1347077979281743875,2021-01-07 07:09:52+00:00,boblister_poole,"US Capitol riots: Four dead after Trump protesters storm Washington - latest news
https://t.co/MH8JCQrC9C",,
849,1347077733759770624,2021-01-07 07:08:53+00:00,deadceleb,"Facebook, Twitter and YouTube take action on Trump’s posts amid riots at the US Capitol https://t.co/XB91uctg5d",,
850,1347077213955510273,2021-01-07 07:06:49+00:00,CosmicSky22,Riot at US Capitol: Four dead as outrage grows over Trump-inspired mob's storming of Congress | US News | Sky News https://t.co/eWvQAyDN9z,,
851,1347077209736044544,2021-01-07 07:06:48+00:00,FletchTheTrader,Riot at US Capitol: Four dead as outrage grows over Trump-inspired mob's storming of Congress | US News | Sky News https://t.co/a9V3Hwl8Sn,,
852,1347076817866338305,2021-01-07 07:05:15+00:00,newsoneplace,(Metro):Four dead in #US #Capitol riots as woman shot by police is named : Trump supporter Ashli Babbit was shot dead during the chaotic scenes after rioters stormed the building. .. https://t.co/WIr8BrfB4x https://t.co/28Qr2CU40l,"[Photo(previewUrl='https://pbs.twimg.com/media/ErHHOfLXAAAnuwg?format=jpg&name=small', fullUrl='https://pbs.twimg.com/media/ErHHOfLXAAAnuwg?format=jpg&name=orig', altText=None)]","['US', 'Capitol']"
853,1347076571350372353,2021-01-07 07:04:16+00:00,thehimalayan,"Twitter and Facebook Inc on Wednesday temporarily locked the accounts of US President Donald Trump, as tech giants scrambled to crack down on his baseless claims about the US presidential elections amid riots at the US Capitol. https://t.co/DKIlnor7Kn",,
854,1347076521245118466,2021-01-07 07:04:04+00:00,BethanyinCBR,"These deaths are directly because of Donald Trump. He has blood on his hands. “US Capitol riots by Donald Trump supporters end with four deaths, including a woman shot by police” https://t.co/VZHHcMvQXe",,
855,1347076445965668355,2021-01-07 07:03:46+00:00,dannowicki,"""'A direct attack on democracy': World leaders react with shock, sadness after Trump supporters riot at US Capitol."" (via @USATODAY) https://t.co/3KmqBP5pVS",,
856,1347076381419692032,2021-01-07 07:03:31+00:00,Alan_McGuinness,"Riot at US Capitol: Four dead as outrage grows over Trump-inspired mob's storming of Congress

Follow live updates: https://t.co/rAcCURUBQS",,
857,1347076050552037376,2021-01-07 07:02:12+00:00,AgnesClackett,US Capitol riots: Four dead after Trump protesters storm Washington - latest news - The Telegraph https://t.co/IYBwxSa762,,
858,1347075165709066244,2021-01-07 06:58:41+00:00,DrRossShields,"🤔 So the police can disburse a crowd without riot gear, tanks, and slaughtering American citizens...hmm and all this time they told us it wasn't possible 🤔 
#Trump #WashingtonDC #25thAmendment #whiteprivilege #Capitol #democracy #CapitolBuilding #coup #BlackTwitter #BLM https://t.co/I0nVBC02Rm","[Photo(previewUrl='https://pbs.twimg.com/media/ErHFuXsXMAQuXPS?format=jpg&name=small', fullUrl='https://pbs.twimg.com/media/ErHFuXsXMAQuXPS?format=jpg&name=orig', altText=None)]","['Trump', 'WashingtonDC', '25thAmendment', 'whiteprivilege', 'Capitol', 'democracy', 'CapitolBuilding', 'coup', 'BlackTwitter', 'BLM']"
859,1347074419336892418,2021-01-07 06:55:43+00:00,FOX40,"Lincoln Project co-founder Mike Madrid reacts to riot at US Capitol, Trump's response https://t.co/1Jh5vkEiQg",,
860,1347073981401075713,2021-01-07 06:53:59+00:00,FergusHancock,"Stop calling the violent invaders of the US Capitol 'protestors' or mere 'Trump supporters'. These are fascist terrorists. A woman has died after being shot in this riot and three other people died of medical emergencies.

This an attempted fascist coup. Call it that.",,
861,1347073828208447488,2021-01-07 06:53:22+00:00,Meredith_Kinsle,"US Capitol riots by Donald Trump supporters end with four deaths, including a woman shot by police https://t.co/zxVGysXsVe",,
862,1347073575228882945,2021-01-07 06:52:22+00:00,dkp1903,"Donald Trump's incitement of today's riots on the US Capitol should be denounced by all democratic leaders. 

This isn't just an assault on US Congressional offices, but on the very idea of democracy

I call my own country's leader - @narendramodi to take lead

#USAElections2020",,['USAElections2020']
863,1347073042669735937,2021-01-07 06:50:15+00:00,cjblady,Trump Inspired Riot at US Capitol During Election Certification. America... https://t.co/6CCIhXxsUg via @YouTube,,
864,1347072927288745985,2021-01-07 06:49:47+00:00,muhirwa_yves,Riot at US Capitol: Four dead as outrage grows over Trump-inspired mob's storming of Congress https://t.co/IYx05nMhvT,,
865,1347072894078234626,2021-01-07 06:49:40+00:00,UrbanTake_001,"#Trump #PoliceBrutality #Police #BlueLivesMatter #LawEnforcement #CapitolHill #CapitolPolice #LawAndOrder #ThursdayThoughts #America #Americans #riots 

Police taking photos with the mob that storm the US CAPITOL. Congress need to investigate law enforcement https://t.co/iKn2mopMfJ","[Video(thumbnailUrl='https://pbs.twimg.com/ext_tw_video_thumb/1347072870955028480/pu/img/UamaPz4KbX_4-mph.jpg', variants=[VideoVariant(url='https://video.twimg.com/ext_tw_video/1347072870955028480/pu/vid/848x480/QdFXIoBATPR8mTGp.mp4?tag=10', contentType='video/mp4', bitrate=2176000), VideoVariant(url='https://video.twimg.com/ext_tw_video/1347072870955028480/pu/pl/-pQ-3RUdyWdfBc9Z.m3u8?tag=10', contentType='application/x-mpegURL', bitrate=None), VideoVariant(url='https://video.twimg.com/ext_tw_video/1347072870955028480/pu/vid/636x360/jFRllM9A1MW0TP6y.mp4?tag=10', contentType='video/mp4', bitrate=832000), VideoVariant(url='https://video.twimg.com/ext_tw_video/1347072870955028480/pu/vid/476x270/L8UOafQ_eDKN5U75.mp4?tag=10', contentType='video/mp4', bitrate=256000)], duration=8.959, views=78, altText=None)]","['Trump', 'PoliceBrutality', 'Police', 'BlueLivesMatter', 'LawEnforcement', 'CapitolHill', 'CapitolPolice', 'LawAndOrder', 'ThursdayThoughts', 'America', 'Americans', 'riots']"
866,1347072781326942208,2021-01-07 06:49:13+00:00,newsoneplace,(WalesOnline):#Trump riots at the US #Capitol - everything we know so far : The President has been banned from social media .. https://t.co/APBnd8OzMA https://t.co/atxP99N1VQ,"[Photo(previewUrl='https://pbs.twimg.com/media/ErHDjn2XcAAmaDY?format=jpg&name=small', fullUrl='https://pbs.twimg.com/media/ErHDjn2XcAAmaDY?format=jpg&name=orig', altText=None)]","['Trump', 'Capitol']"
867,1347072553949536256,2021-01-07 06:48:18+00:00,Phill59316885,"https://t.co/FWzGzWKDUs: US Capitol lockdown LIVE: Shot woman among 4 dead after Trump mob riots with 52 arrested.
https://t.co/q8kGqtiVin

via @GoogleNews",,
868,1347072321400483842,2021-01-07 06:47:23+00:00,Jo82679398,Riot at US Capitol: Four dead as outrage grows over Trump-inspired mob's storming of Congress https://t.co/ldciTLuMEx,,
869,1347072065061363714,2021-01-07 06:46:22+00:00,dazza_double_u,"US Capitol riots by Donald Trump supporters end with four deaths, including a woman shot by police - ABC News https://t.co/YOdJXjrt7L",,
870,1347071732335710208,2021-01-07 06:45:03+00:00,TheInfoNG,"Facebook, Twitter and YouTube take action on Trump's posts amid riots at the US Capitol https://t.co/nzl7FfArKb",,
871,1347071715348766721,2021-01-07 06:44:58+00:00,sudhvir,"So this is the threshold to consider resigning? A bit late?

US riots at Capitol Hill: Kiwi Chris Liddell weighs up resigning as Donald Trump's deputy chief of staff 
https://t.co/mrseuj9jHw",,
872,1347071046520721409,2021-01-07 06:42:19+00:00,mediawatcher83,"Seriously, fuck #ourabc . The news banner refers to “protests at US Capitol”. They were DEADLY RIOTS BAITED BY LIES FROM THE US PRESIDENT. Call it was it is. White trash baiting by #trump caused this #treason &amp; the bait itself is treasonous #sedition #CapitolBuilding https://t.co/ZTl0WvJSdY","[Photo(previewUrl='https://pbs.twimg.com/media/ErHB-CHUUAMlvq6?format=jpg&name=small', fullUrl='https://pbs.twimg.com/media/ErHB-CHUUAMlvq6?format=jpg&name=orig', altText=None)]","['ourabc', 'trump', 'treason', 'sedition', 'CapitolBuilding']"
873,1347070991415971841,2021-01-07 06:42:06+00:00,nzheraldbiz,US riots at Capitol Hill: Kiwi Chris Liddell weighs up resigning as Donald Trump's deputy chief of staff https://t.co/tJ5UJXFacj,,
874,1347069256161177603,2021-01-07 06:35:12+00:00,IlkhaAgency,"Death toll from US Capitol riot rises to 4 in U.S. #CongressIsBroken #capitol #CapitolBuilding #capitalbreach #CapitalHill #Trump #CoupAttempt #America #WashingtonDC #WashingtonDCProtest
https://t.co/l5iNLJFdcA https://t.co/ZrMK47loBM","[Photo(previewUrl='https://pbs.twimg.com/media/ErHAVctXAAAUpsx?format=jpg&name=small', fullUrl='https://pbs.twimg.com/media/ErHAVctXAAAUpsx?format=jpg&name=orig', altText=None)]","['CongressIsBroken', 'capitol', 'CapitolBuilding', 'capitalbreach', 'CapitalHill', 'Trump', 'CoupAttempt', 'America', 'WashingtonDC', 'WashingtonDCProtest']"
875,1347069031673597957,2021-01-07 06:34:19+00:00,anshuman_ujjain,"#USCapitol
Trump supporters staging a riot in US Capitol after he lost the elections

Meanwhile Mamta Didi who is about to lose the Bengal election https://t.co/abZC9qiEYW","[Photo(previewUrl='https://pbs.twimg.com/media/ErHAJQPUUAEeFiG?format=jpg&name=small', fullUrl='https://pbs.twimg.com/media/ErHAJQPUUAEeFiG?format=jpg&name=orig', altText=None)]",['USCapitol']
876,1347068204867313665,2021-01-07 06:31:02+00:00,blfrnk,US: Trump’s Actions Fuel Capitol Riot | Human Rights Watch https://t.co/0KRXU5LjbT,,
877,1347068021077143552,2021-01-07 06:30:18+00:00,reportaznews,"Capitol riots: Four die as Trump supporters storm US Capitol

https://t.co/EdrIJoetq1",,
878,1347067731284262912,2021-01-07 06:29:09+00:00,CristianNord,"World Leaders Condemn Pro-Trump Riot at US Capitol
not one of the Leaders will condemn the #racist and unnecessary violence and looting by the #BlackLivesMatter hooligans..
#USA #art #Trump2020 #Trump #BidenWillNeverBePresident",,"['racist', 'BlackLivesMatter', 'USA', 'art', 'Trump2020', 'Trump', 'BidenWillNeverBePresident']"
879,1347067171663343616,2021-01-07 06:26:55+00:00,JimBonz,Trump Inspired Riot at US Capitol During Election Certification. America... https://t.co/6jBFauMLOb via @YouTube,,
880,1347066814208028672,2021-01-07 06:25:30+00:00,jonesizabela,"What scares me so much about this Capitol riot, is that we messaged our friends in america about it and she replied telling us it wasn’t Trump supporters, but rather people being paid by Antifa and BLM.. how can people genuinely believe that absolute bullshit.",,
881,1347066411185704960,2021-01-07 06:23:54+00:00,newstrackmedia,"US Capitol breached by Trump supporters. Curfew situation in Washington DC.
The world leaders condemned the riots.

#USCapitol #WashingtonDC #Trump #Newstrack https://t.co/OmCybSVpid",,"['USCapitol', 'WashingtonDC', 'Trump', 'Newstrack']"
882,1347066166594957312,2021-01-07 06:22:56+00:00,sevenbowie,DC Police Chief: 4 people died at the US Capitol Trump riots - 52 arrested. https://t.co/6PGovgTia7,,
883,1347065649860907008,2021-01-07 06:20:52+00:00,jonathan_antrim,"US Capitol secured, 4 dead after rioters stormed the halls of Congress to block Biden's win.

Melania Trump's chief of staff resigns in wake of riots.

#PresidentTrump https://t.co/EROZnqIoKg","[Photo(previewUrl='https://pbs.twimg.com/media/ErG9D6uWMAAi9zB?format=jpg&name=small', fullUrl='https://pbs.twimg.com/media/ErG9D6uWMAAi9zB?format=jpg&name=orig', altText=None), Photo(previewUrl='https://pbs.twimg.com/media/ErG9EFlXcAA0BNy?format=jpg&name=small', fullUrl='https://pbs.twimg.com/media/ErG9EFlXcAA0BNy?format=jpg&name=orig', altText=None), Photo(previewUrl='https://pbs.twimg.com/media/ErG9EQtW8AAptEb?format=jpg&name=small', fullUrl='https://pbs.twimg.com/media/ErG9EQtW8AAptEb?format=jpg&name=orig', altText=None), Photo(previewUrl='https://pbs.twimg.com/media/ErG9EbEXYAEbyAy?format=jpg&name=small', fullUrl='https://pbs.twimg.com/media/ErG9EbEXYAEbyAy?format=jpg&name=orig', altText=None)]",['PresidentTrump']
884,1347065316510199809,2021-01-07 06:19:33+00:00,MechailBoriss,"Twitter and Facebook temporarily freeze Trump’s accounts following his followers' riots at the US Capitol and the social media platforms' struggle to crack down on his baseless election claims. I think Twitter and Facebook trying to hide the shame of America.
#WashingtonDC",,['WashingtonDC']
885,1347064899688493057,2021-01-07 06:17:53+00:00,LoverPhotog,🙏🇺🇸Trump supporter shot during US Capitol riot https://t.co/awBVkCGq5d via @MailOnline,,
886,1347064395524755456,2021-01-07 06:15:53+00:00,FloydWhaley,Weirdest Moment of the US Capitol Riot: A Walis Tambo Being Paraded by a Filipino Trump Supporter https://t.co/KUK2rpQLhO #Esquiremag.ph via @EsquirePH,,['Esquiremag']
887,1347064174745161737,2021-01-07 06:15:01+00:00,UkAtomRadio,#News: Riot at US Capitol: Four dead as outrage grows over Trump-inspired mob's storming of Congress https://t.co/XZEZgNkvSy,,['News']
888,1347064051969437696,2021-01-07 06:14:31+00:00,JInfo4us,"Michigan members of Congress react to riot at US Capitol
https://t.co/2oFlK7l7Ad
#democratic #election #trump #vote #republican #democrats #usa #politics #joebiden #democrat #america #maga #president #biden #democracy #blm #news #revolution #liberal #covid #democraticparty #peopl",,"['democratic', 'election', 'trump', 'vote', 'republican', 'democrats', 'usa', 'politics', 'joebiden', 'democrat', 'america', 'maga', 'president', 'biden', 'democracy', 'blm', 'news', 'revolution', 'liberal', 'covid', 'democraticparty', 'peopl']"
889,1347063988446765058,2021-01-07 06:14:16+00:00,DownatthePound,Trump Inspired Riot at US Capitol During Election Certification. America... https://t.co/G6bdkbXe0u via @glennkirschner2,,
