,ID,Date,User,Tweet,Media,Hashtags
375,1347233210816720896,2021-01-07 17:26:42+00:00,jim261bob,"Merkel slams Trump over US Capitol riots.

Funny how the Furher Angela Merkel never said a word when the Democrats aka Socialists stormed the building when Kavanaugh was being confirmed  

  #AngelaMerkel 
#Globalist

 https://t.co/GDAcA30gtu",,"['AngelaMerkel', 'Globalist']"
376,1347233176184180739,2021-01-07 17:26:34+00:00,AhmadNorMaulana,Trump to flee DC for Camp David this weekend after his supporters trashed the US Capitol in a riot https://t.co/TxrELKd3NT https://t.co/PNtYDnxytn,"[Photo(previewUrl='https://pbs.twimg.com/media/ErJVby4VkAAGfSy?format=jpg&name=small', fullUrl='https://pbs.twimg.com/media/ErJVby4VkAAGfSy?format=jpg&name=orig', altText=None)]",
377,1347232730363269120,2021-01-07 17:24:47+00:00,stuhunter1,"Make trump a national pariah:

Online stores run by the trump Org &amp; trump campaign were taken offline by Shopify in response to the Wed. riot at the US Capitol

The company said trump violated the company’s policy, which prohibits retailers on the platform from promoting violence",,
378,1347232560808681472,2021-01-07 17:24:07+00:00,sdbast,Four dead after Trump provokes US Capitol riot – and the UK Tories are taking notes https://t.co/yqvlITOxtW,,
379,1347232420198817793,2021-01-07 17:23:34+00:00,UTD_AFT1974,The @AFTunion has called on President Donald Trump to be removed from office after yesterday's riots on the US Capitol. @rweingarten  Read the full statement here: https://t.co/08w7rZVHaY https://t.co/qP5C3ghO1a,"[Photo(previewUrl='https://pbs.twimg.com/media/ErJUIDmXYAAags5?format=jpg&name=small', fullUrl='https://pbs.twimg.com/media/ErJUIDmXYAAags5?format=jpg&name=orig', altText=None)]",
380,1347232360668954630,2021-01-07 17:23:19+00:00,BernardHunwick,"'A direct attack on democracy': World leaders react with shock after Trump supporters riot at US Capitol
https://t.co/nIPjkxlbiS",,
381,1347232091201798145,2021-01-07 17:22:15+00:00,thomaskaine5,Trump to flee DC for Camp David this weekend after his supporters trashed the US Capitol in a riot https://t.co/Tm87t9eLKZ,,
382,1347231992782450689,2021-01-07 17:21:52+00:00,JohnWirt1,'A direct attack on democracy': World leaders react with shock after Trump supporters riot at US Capitol https://t.co/fyZyfIGjaW,,
383,1347231815048830979,2021-01-07 17:21:09+00:00,mjh0421,Four dead after Trump provokes US Capitol riot - and the UK Tories are taking notes https://t.co/U8P5C6hbj9 via @MidWalesMike,,
384,1347231766176677889,2021-01-07 17:20:58+00:00,barryrutherford,"US riots LIVE updates: Capitol Hill violence condemned as Democrats, Republicans unite against Trump's false claims of election fraud https://t.co/HJLTaLU1T0",,
385,1347231683817267200,2021-01-07 17:20:38+00:00,MSN,Trump to flee DC for Camp David this weekend after his supporters trashed the US Capitol in a riot https://t.co/fLlrHvHaZf,,
386,1347231683657965569,2021-01-07 17:20:38+00:00,microsoftnews,Trump to flee DC for Camp David this weekend after his supporters trashed the US Capitol in a riot https://t.co/hme5kogkuX,,
387,1347231286297993216,2021-01-07 17:19:03+00:00,marciojmsilva,Trump to flee DC for Camp David this weekend after his supporters trashed the US Capitol in a riot https://t.co/xG0KhTt8c8 https://t.co/9T1nIfpWbC,"[Photo(previewUrl='https://pbs.twimg.com/media/ErJTtytU0AIBFZJ?format=jpg&name=small', fullUrl='https://pbs.twimg.com/media/ErJTtytU0AIBFZJ?format=jpg&name=orig', altText=None)]",
388,1347231282531495937,2021-01-07 17:19:02+00:00,ManLeeHood,Trump to flee DC for Camp David this weekend after his supporters trashed the US Capitol in a riot https://t.co/QAFdKRCmZV,,
389,1347230886589173761,2021-01-07 17:17:28+00:00,giveoutmore,"After Capitol riots, Russia slams US’s ‘archaic’ electoral system | Donald Trump News | Al Jazeera https://t.co/7pkfvIs82F via @AJEnglish",,
390,1347230595932430338,2021-01-07 17:16:19+00:00,BusinessInsider,Trump to flee DC for Camp David this weekend after his supporters trashed the US Capitol in a riot https://t.co/vQxioXhiJH,,
391,1347230333054431232,2021-01-07 17:15:16+00:00,DE3x2ydy_dx,'A direct attack on democracy': World leaders react with shock after Trump supporters riot at US Capitol https://t.co/vAbFPSodW2,,
392,1347230227756441605,2021-01-07 17:14:51+00:00,CNN,"William Barr, Trump’s former Attorney General, accused the President of “orchestrating a mob to pressure Congress” and called his conduct a “betrayal of his office” in response to pro-Trump riots that took place at the US Capitol on Wednesday. https://t.co/AcFljr1Hjp",,
393,1347229693766995968,2021-01-07 17:12:43+00:00,jannikkel6,"Calls grow for #Trump's removal after inciting deadly riot at US #Capitol

https://t.co/lZ4woAQAmQ",,"['Trump', 'Capitol']"
394,1347229618445676546,2021-01-07 17:12:26+00:00,RJP56,'A direct attack on democracy': World leaders react with shock after Trump supporters riot at US Capitol https://t.co/ywCyLMk3JM,,
395,1347228657912221697,2021-01-07 17:08:37+00:00,arunbnaik,Will Donald Trump be arrested for inciting riots in US Capitol? True test of American rule of law #CapitolRiots,,['CapitolRiots']
396,1347228376235352069,2021-01-07 17:07:29+00:00,kimberlycronkr3,"World leaders condemn 'horrifying' riot at US Capitol building - CNN

What an embarrassment to the rest of the world due to Donald Trump’s actions https://t.co/9xsmZSRUrG",,
397,1347228131246145536,2021-01-07 17:06:31+00:00,elizondogabriel,"In the final days of the Trump presidency, a wall is being built. 

Around the US Capitol.

Seriously. A 7 foot high, non-scalable wall is going to be built around the US Capitol after the riots. The wall be remain up for at least 30 days.",,
398,1347227989545725953,2021-01-07 17:05:57+00:00,JD332,"Donald Trump, Donald, Jr. and Rudy Giuliani are the ring leaders of the mob that attacked the US Capitol bldg.  Their actions directly led to the attack and subsequent death of 4 people.  They should be arrested and charged with inciting a riot and manslaughter. @RudyGiuliani",,
399,1347227870163128322,2021-01-07 17:05:29+00:00,180099native,"In 1 hour: After yesterday's violent riot by Trump supporters at the US Capitol--what now? We'll get perspective on the day's events and what the future might have in store    
https://t.co/gl6YaEx8Oo https://t.co/SYu4FleSfF","[Photo(previewUrl='https://pbs.twimg.com/media/ErJQkp0VkAAjbtm?format=jpg&name=small', fullUrl='https://pbs.twimg.com/media/ErJQkp0VkAAjbtm?format=jpg&name=orig', altText=None)]",
400,1347227455006924803,2021-01-07 17:03:50+00:00,jlq87,"If you did not get to see the video Trump posted yesterday before Twitter took it down, it's embedded in this Sun video recapping the events.

D.C riot - MAGA fanatics erect GALLOWS outside US Capitol as the building is overrun and lawmakers trapped inside https://t.co/o2IzedHgg4",,
401,1347227412631855104,2021-01-07 17:03:40+00:00,AC_Graff,"Today's headlines from around the world show different interpretations of the historic assault on US #Capitol. Some call them 'riots', others - 'protests'. Some link them to Trump, others skirt the issue. A political spectrum on display. #US #CapitolRiots #CapitolBuilding",,"['Capitol', 'US', 'CapitolRiots', 'CapitolBuilding']"
402,1347227261137780737,2021-01-07 17:03:03+00:00,freep,Facebook bans Trump indefinitely following US Capitol riots https://t.co/A3xNke1I5z,,
403,1347226742512095236,2021-01-07 17:01:00+00:00,MirrorCeleb,"Kate Ferdinand decries Donald Trump response to US Capitol riots compared to BLM
https://t.co/O3btXNfO5X https://t.co/jSzw1Sjcn0","[Photo(previewUrl='https://pbs.twimg.com/media/ErIUSiBXEAE2tEQ?format=jpg&name=small', fullUrl='https://pbs.twimg.com/media/ErIUSiBXEAE2tEQ?format=jpg&name=orig', altText=None)]",
404,1347226020479291392,2021-01-07 16:58:08+00:00,MASAE89,"What happened to all of those Republicans who said if Trump had lost in 2016, you wouldn't see them rioting and marching. Russia helped Trump win in '16. Trump yells baseless claims of massive fraud in 2020 and those same Republicans riot and vandalize the US Capitol bldg. AntiUS",,
405,1347225147967729665,2021-01-07 16:54:40+00:00,TalkTV,"Donald Trump's former deputy campaign manager Rick Gates says the president was not responsible for yesterday's US Capitol riots: ""He said we're here for peaceful protesting"".

@mrmarkdolan https://t.co/arT5SoV2vc","[Video(thumbnailUrl='https://pbs.twimg.com/amplify_video_thumb/1347224783428091904/img/eH56WuGumDUo9RoK.jpg', variants=[VideoVariant(url='https://video.twimg.com/amplify_video/1347224783428091904/vid/480x270/qtFwg4uYKQvz1Y05.mp4?tag=13', contentType='video/mp4', bitrate=288000), VideoVariant(url='https://video.twimg.com/amplify_video/1347224783428091904/vid/1280x720/p4hIkF5eX16i2nU7.mp4?tag=13', contentType='video/mp4', bitrate=2176000), VideoVariant(url='https://video.twimg.com/amplify_video/1347224783428091904/pl/WQm-AEXKy6dTeNEY.m3u8?tag=13', contentType='application/x-mpegURL', bitrate=None), VideoVariant(url='https://video.twimg.com/amplify_video/1347224783428091904/vid/640x360/OYC_lhENPfvq4Iky.mp4?tag=13', contentType='video/mp4', bitrate=832000)], duration=186.936, views=5629, altText=None)]",
406,1347225052165644291,2021-01-07 16:54:17+00:00,TheWarNerd,"A perfect example of right-wing rhetoric on the Capitol riots: 
""I don't think it's Trump supporters that are causing the ruckus.  If it truly is can you blame them?  They've been pushed too far!""
That is: ""We didn't do it, and besides you MADE us do it!""",,
407,1347224984435888128,2021-01-07 16:54:01+00:00,denasd,Newspapers around the world reacted to the US Capitol riots -THE WORLD is LAUGHING at #AMERICA THANKS to #TRUMP and his complicit IMBECILES ⁦@RepMattGaetz⁩  ⁦@SenTedCruz⁩ ⁦⁦@SenHawleyPress⁩  #TrumpIsANationalDisgrace #25thAmendmentNow  https://t.co/yoB0m13tSL,,"['AMERICA', 'TRUMP', 'TrumpIsANationalDisgrace', '25thAmendmentNow']"
408,1347224782027300870,2021-01-07 16:53:12+00:00,lof_marie,"Time for another tone in the US - with Warnock &amp; Ossoff giving Democrats control of Senate it's time for politics for  climate, for environment &amp; for all humans

Trump's former attorney general Bill Barr says president 'orchestrated' Capitol riot – live https://t.co/qGTOk3YsLz",,
409,1347224145701072896,2021-01-07 16:50:41+00:00,marmitemarmz,"As supporters of President Donald Trump stormed the US Capitol Building in a riot on Wednesday, one QAnon figure stood out among the mob: the ""Q Shaman,"" aka Jake Angeli. 

 https://t.co/OXpHufbSsW",,
410,1347223604300292101,2021-01-07 16:48:32+00:00,geostanley,Front pages capture chaos of riots at US Capitol incited by Donald Trump's rage over American voters rejecting him for a second term. Last time the Capitol was besieged was when British Army looted &amp; burned in the name of King George during War of 1812 https://t.co/sNmyWakR2z,,
411,1347223422510788611,2021-01-07 16:47:48+00:00,tkn_one,Delusional Woman killed in Capitol riot shooting identified as US Air Force veteran - #trump supporter https://t.co/wwO3sCPPMX,,['trump']
412,1347223368160976898,2021-01-07 16:47:35+00:00,JD332,Donald J Trump is the ring leader of the mob that attacked the US Capitol building.  His actions directly led to the attack and subsequent death of 4 people.  He should be arrested and charged with inciting a riot and manslaughter. @DCPoliceDept @CNN @MSNBC @FBI,,
413,1347223080469475332,2021-01-07 16:46:27+00:00,NEWSWORLD555,"US Capitol riots: Trump commits to peaceful transition after Biden certified as President - latest news - https://t.co/kKTci9H8C5
US Capitol riots: Trump commits to peaceful transition after Biden certified as President - latest news  .ukFaceboo…
https://t.co/stfKeeS6Nt
#News UK https://t.co/YUjlhlrUQa","[Photo(previewUrl='https://pbs.twimg.com/media/ErJMPy3VEAIwRrG?format=jpg&name=small', fullUrl='https://pbs.twimg.com/media/ErJMPy3VEAIwRrG?format=jpg&name=orig', altText=None)]",['News']
414,1347222764474822658,2021-01-07 16:45:11+00:00,SafetyPinDaily,US: Trump's Actions Fuel Capitol Riot | Via Human Rights Watch https://t.co/oW7XpLwMeN,,
415,1347222445019725826,2021-01-07 16:43:55+00:00,MBot5000,Krystal and Saagar REACT: Trump Incites Riot At US Capitol In Shameful D... https://t.co/wcAYx9cnix via @YouTube,,
416,1347221907448487936,2021-01-07 16:41:47+00:00,JD332,"Donald J Trump, Donald Trump, Jr., Rudy Guliani are the ring leaders of the mob that attacked the US Capitol building.  Their actions directly led to the attack and subsequent death of 4 people.  They should be arrested and charged with inciting a riot and manslaughter. @MSNBC",,
417,1347221575465136130,2021-01-07 16:40:28+00:00,worldnewstweet_,Trump agrees to 'orderly transition' as four die in US Capitol riots https://t.co/0tgPKGc6c6,,
418,1347221197096955906,2021-01-07 16:38:58+00:00,republic,"US Capitol riots: Facebook blocks Trump's accounts indefinitely, states 'risks too great' https://t.co/VUUwkupidp",,
419,1347221125961560067,2021-01-07 16:38:41+00:00,RichardTheusch,'A direct attack on democracy': World leaders react with shock after Trump supporters riot at US Capitol https://t.co/8PYwlw4PR8,,
420,1347220542571618305,2021-01-07 16:36:22+00:00,susan_bagheri,Former Tory councillor sparks outrage for calling Trump 'statesmanlike' during US Capitol riots https://t.co/BmHUnKZgDB,,
421,1347220408425193477,2021-01-07 16:35:50+00:00,electionnewsbay,"Amid US Capitol Riot, Iraq Court Issues Arrest Warrant Against Trump For Killing of Iranian General … https://t.co/8NSdLxlog8",,
422,1347219771016826880,2021-01-07 16:33:18+00:00,moses_nyagota,"Facebook and Instagram ban Donald Trump 'indefinitely' after riot at US capitol
#BanTrump 
#Trump https://t.co/b5iwkunqOZ","[Photo(previewUrl='https://pbs.twimg.com/media/ErJJPbeXAAMTR-U?format=jpg&name=small', fullUrl='https://pbs.twimg.com/media/ErJJPbeXAAMTR-U?format=jpg&name=orig', altText=None)]","['BanTrump', 'Trump']"
423,1347219557165846530,2021-01-07 16:32:27+00:00,thebax33,"“The 35-year-old regularly vocalized her support for Trump on Twitter. While she seldom tweeting herself, she often re-shared posts from conservative and right-wing figures, including Michael Flynn, Jack Posobiec and Lin Wood.”

🖕🏿🙄

US Capitol riots:  https://t.co/e5KUbfNI5Y",,
424,1347219119435902976,2021-01-07 16:30:42+00:00,girlsreallyrule,"The Trump Organization website (https://t.co/GdeXKkQToe) has been taken offline. Per @carlquintanilla: Shopify has shut down the site, along with all of Trump's Campaign E-commerce sites, in response to the riots at the US Capitol.",,
425,1347218942394187777,2021-01-07 16:30:00+00:00,USNews_b,"Facebook and Instagram make Trump's ban indefinite (Engadget)

Amid the riots that took place at the Capitol on Wednesday as Congress met to certify the results...

Add your highlights:
https://t.co/7RoXq3UiRS
 #usnews #us #news",,"['usnews', 'us', 'news']"
426,1347218938652995584,2021-01-07 16:29:59+00:00,txbeergoddess,"Krystal is 🔥🔥 this morning! 
""This country is a tinder box. This shit is not a game.""

Krystal and Saagar REACT: Trump Incites Riot At US Capitol In Shameful D... https://t.co/0Dt3l6qcc9 via @YouTube",,
427,1347218439333675009,2021-01-07 16:28:00+00:00,NewstalkFM,Facebook has “indefinitely” blocked outgoing US President Donald Trump’s account after yesterday’s riots at the US Capitol. https://t.co/lGdaZEahwC,,
428,1347218373449551888,2021-01-07 16:27:44+00:00,voteblue8888,"Capitol Hill riot: Timeline of how events unfolded in Washington How a Trump mob stormed the US Capitol, forcing Washington into lockdown
One woman was shot and killed as a pro-Trump mob battled police, broke into the U.S. Capitol and swept through  https://t.co/tfezPYNA3Q",,
429,1347218335608532997,2021-01-07 16:27:35+00:00,octaviorojas,"https://t.co/FE2nhXgtLp Twitter and Facebook suspend Trump, top execs respond to US Capitol riots, and Family Video to permanently close https://t.co/O77hWIHUQS","[Photo(previewUrl='https://pbs.twimg.com/media/ErJH7_PXEAwtj4a?format=jpg&name=small', fullUrl='https://pbs.twimg.com/media/ErJH7_PXEAwtj4a?format=jpg&name=orig', altText=None)]",
430,1347218334224441347,2021-01-07 16:27:35+00:00,doc_terror,Talked to @SkyNews @AlexMartin today about how the Trump supporters organised the US Capitol Riots. https://t.co/Z6G0gOnhaG @UCLan @UCLanPolitics,,
431,1347218279291637760,2021-01-07 16:27:22+00:00,labourblackrose,Four dead after Trump provokes US Capitol riot - and the UK Tories are taking notes https://t.co/p1Lg1SRHvO via @MidWalesMike,,
432,1347218085166641157,2021-01-07 16:26:36+00:00,enggmrahman,"Twitter and Facebook suspend Trump, top execs respond to US Capitol riots, and Family Video to permanently close https://t.co/iUJVVQIsFZ https://t.co/nCQZHDGCE2",,
433,1347218019597103104,2021-01-07 16:26:20+00:00,HilarySmith8,Four dead after Trump provokes US Capitol riot - and the UK Tories are taking notes https://t.co/EX140YsC7A via @MidWalesMike,,
434,1347217885635219457,2021-01-07 16:25:48+00:00,deardrewdixon,"A 74 yr old white man (and our so-called POTUS) foments a deadly and destructive riot at the US Capitol, and his social media accounts are cancelled? 

Is Trump our teenage son?

Trayvon Martin was murdered for carrying Skittles. 
Tamir Rice was murdered for holding a toy gun.",,
435,1347217866999951360,2021-01-07 16:25:44+00:00,BanglaViral,US Capitol riot: Eric Trump speaks at the Save America March in DC https://t.co/RStJyJqcTD,,
436,1347217621331095554,2021-01-07 16:24:45+00:00,kenstine,"Trump banned from Facebook. Twitter will be the next to ban him👇

Riot at US Capitol live: Trump banned from Facebook after mob storms Capitol - amid calls for him to be removed from White House now | US News | Sky News https://t.co/ioPFKzglD1",,
437,1347217617573064705,2021-01-07 16:24:44+00:00,SandyJLMurdock,Facebook bans Donald Trump's social accounts indefinitely following US Capitol riot https://t.co/u7qRwKSklT via @freep,,
438,1347217235664900102,2021-01-07 16:23:13+00:00,zinemaniac,"#Coup #politics #svpol 

Krystal and Saagar REACT: Trump Incites Riot At US Capitol In Shameful D... https://t.co/2R4M7JndUB via @YouTube",,"['Coup', 'politics', 'svpol']"
439,1347217235396407298,2021-01-07 16:23:13+00:00,itvnews,"Facebook and Instagram ban Donald Trump 'indefinitely' after riot at US capitol
https://t.co/pREP9xAjVX",,
440,1347216572327329795,2021-01-07 16:20:35+00:00,FOX13News,"#BREAKING: Facebook is banning President Trump from posting on the social media site until at least Biden's inauguration, saying the risk of his posts is ""too great"" following yesterday's riot at the US Capitol. https://t.co/9p1NF9F4nU",,['BREAKING']
441,1347216532066213888,2021-01-07 16:20:25+00:00,dianeschwartz,"Twitter and Facebook suspend Trump, top execs respond to US Capitol riots, and much more PR news from a whirlwind day @PRDaily #crisis  https://t.co/4FNYhaIoF9",,['crisis']
442,1347216376742760449,2021-01-07 16:19:48+00:00,JohnArchbell,"Absolutely horrific video clip inside the article. The only person Trump loves is himself. 

As the Bowie song title suggests, #thisisnotamerica #PresidentBiden #USAElections2020 Congress confirms Joe Biden’s victory after US Capitol riots

https://t.co/JnYaSwPqGA",,"['thisisnotamerica', 'PresidentBiden', 'USAElections2020']"
443,1347216063902011393,2021-01-07 16:18:34+00:00,bmangh,'A direct attack on democracy': World leaders react with shock after Trump supporters riot at US Capitol https://t.co/EzVgY97zSV,,
444,1347215994431938563,2021-01-07 16:18:17+00:00,binnie_sandhu,Riot at US Capitol live: Trump banned from Facebook after mob storms Capitol - amid calls for him to be removed from White House now | US News | Sky News https://t.co/6jN00jcXJ3,,
445,1347215669360799746,2021-01-07 16:17:00+00:00,NewsTribune,"Trump should 'absolutely not' be blamed for US Capitol riots, Missouri Gov. Parson says, by Jason Hancock via @NewsTribune. #JCMO #MidMO https://t.co/Te17AcRZB2",,"['JCMO', 'MidMO']"
446,1347215638557765637,2021-01-07 16:16:52+00:00,PoliticalSense1,"America the laughing stock of the world thanks to Trump and @GOP.

'Floppy and weak': Iran has joined China and Russia in ridiculing the US on social media over the Capitol riots https://t.co/wYogBVmP4d",,
447,1347215595285176324,2021-01-07 16:16:42+00:00,DomSilva2,Riot at US Capitol live: Trump banned from Facebook after mob storms Capitol - amid calls for him to be removed from White House now | US News | Sky News https://t.co/n1vb4PYFS9,,
448,1347215036905873409,2021-01-07 16:14:29+00:00,Deb62178664,"Biden has an enormous job ahead restoring our country and our standing with the rest of the world.

'A direct attack on democracy': World leaders react with shock after Trump supporters riot at US Capitol https://t.co/MK7CpQqILx",,
449,1347214974909882371,2021-01-07 16:14:14+00:00,Hindu108,"And who were the morons who used BLM to create riots and mayhem in US for a week and they tried to invade capitol hill, white house! Trump had to go underground! None other thsn leftist, Antifa and Jihadis! Our memories are not weak unlike yours!
@tehseenp 
@TimesNow",,
450,1347214969700556805,2021-01-07 16:14:13+00:00,isearch247,"Capitol riots: A visual guide to the storming of Congress - https://t.co/udiFjcFwTw 

By The Visual Journalism Team  BBC News

image copyrightGetty Images

The US is reeling after supporters of President Trump stormed the Capitol building in Washington DC on the day... https://t.co/Jlxervx4p8","[Photo(previewUrl='https://pbs.twimg.com/media/ErJE4BWXUAUuXFp?format=jpg&name=small', fullUrl='https://pbs.twimg.com/media/ErJE4BWXUAUuXFp?format=jpg&name=orig', altText=None)]",
451,1347214904999211010,2021-01-07 16:13:58+00:00,ADrust,Krystal and Saagar REACT: Trump Incites Riot At US Capitol In Shameful D... https://t.co/r40Klo9r7v via @YouTube,,
452,1347214780688330753,2021-01-07 16:13:28+00:00,YellowMustangHi,Trump Inspired Riot at US Capitol During Election Certification. America... https://t.co/DQsZf0xTnp via @YouTube,,
453,1347214410943586305,2021-01-07 16:12:00+00:00,PinkNews,Donald Trump eviscerated by lesbian niece Mary for 'orchestrating' US Capitol white supremacy riots  https://t.co/1N7Pq95YEU,,
454,1347214367281053700,2021-01-07 16:11:49+00:00,Barbara44911367,"Woman killed in Capitol riot shooting identified as US Air Force veteran, reports say https://t.co/L4hhaod2n7 via @Yahoo Oh well she chose to support Trump and be a terrorist....oh well.",,
455,1347214336041750528,2021-01-07 16:11:42+00:00,bentlightnvegas,"US Capitol riots by Donald Trump supporters end with four deaths, including a woman shot by police - ABC News https://t.co/N795Pj9Y9E",,
456,1347213875880423425,2021-01-07 16:09:52+00:00,DavidSharesNews,'A direct attack on democracy': World leaders react with shock after Trump supporters riot at US Capitol https://t.co/IiJXi2lpKu,,
457,1347213515824771074,2021-01-07 16:08:26+00:00,globalissuesweb,"US riots LIVE updates: Capitol Hill violence condemned as Democrats, Republicans unite against Trump's false claims of election fraud https://t.co/mCzljhwc4P https://t.co/4DU0uEusTB","[Photo(previewUrl='https://pbs.twimg.com/media/ErJDjaXXcAEJoaO?format=jpg&name=small', fullUrl='https://pbs.twimg.com/media/ErJDjaXXcAEJoaO?format=jpg&name=orig', altText=None)]",
458,1347212891838160896,2021-01-07 16:05:58+00:00,James_Gale,"""Four dead after Trump provokes US Capitol riot – and the UK Tories are taking notes""
https://t.co/LFZSwxFXmv",,
459,1347212640867786752,2021-01-07 16:04:58+00:00,RobertFillies1,Four dead after Trump provokes US Capitol riot - and the UK Tories are taking notes https://t.co/XIhTclwVht via @MidWalesMike,,
460,1347212476966989824,2021-01-07 16:04:19+00:00,JohnHotsforu,'A direct attack on democracy': World leaders react with shock after Trump supporters riot at US Capitol https://t.co/IaryX7lEiO,,
461,1347212404703293440,2021-01-07 16:04:01+00:00,peaceandlove204,"#usaWhat has been happening in Pakistan in 1999 or 2014 is attacking the Parliament or the Prime Minister's House. Everything is happening in America today.  President Trump's supporters riot in the US Congress building.  Protesters climbed on Capitol Hill are building, https://t.co/66BSVTN46c","[Photo(previewUrl='https://pbs.twimg.com/media/ErJCh3zW8AE9vNg?format=jpg&name=small', fullUrl='https://pbs.twimg.com/media/ErJCh3zW8AE9vNg?format=jpg&name=orig', altText=None), Photo(previewUrl='https://pbs.twimg.com/media/ErJCiGxXMAAt_F5?format=jpg&name=small', fullUrl='https://pbs.twimg.com/media/ErJCiGxXMAAt_F5?format=jpg&name=orig', altText=None), Photo(previewUrl='https://pbs.twimg.com/media/ErJCiVXW8AEdIpR?format=jpg&name=small', fullUrl='https://pbs.twimg.com/media/ErJCiVXW8AEdIpR?format=jpg&name=orig', altText=None), Photo(previewUrl='https://pbs.twimg.com/media/ErJCilAWMAYssWZ?format=jpg&name=small', fullUrl='https://pbs.twimg.com/media/ErJCilAWMAYssWZ?format=jpg&name=orig', altText=None)]",['usaWhat']
462,1347211677259886592,2021-01-07 16:01:08+00:00,wendow,"'Shocking,' 'Disgraceful': World leaders react to riot by Trump supporters at Capitol. Interesting reading statements from these leaders. They have hope for us, but right now, we’ve fallen in our world standing. https://t.co/VbMurBgIKs",,
463,1347210949615374337,2021-01-07 15:58:15+00:00,the_subcon,"SPOT. ON.

Krystal and Saagar REACT: Trump Incites Riot At US Capitol In Shameful Day Of US History

https://t.co/JajXtjBotR",,
464,1347210616763801600,2021-01-07 15:56:55+00:00,happymartie1,'A direct attack on democracy': World leaders react with shock after Trump supporters riot at US Capitol https://t.co/J27BLWipcx,,
